{"analysis_bundle_id":"sha256:c7852cfdf30a631571f802cd21305e60d215ac69f0965e6008c671a922e8f9e9","authority":"PINNED_LOCAL_SOURCE_ONLY; no live freshness, independent acceptance or execution authority","budget":{"max_bytes":1048576,"max_files":20},"contract":"devostasis.code-packet.v1","files":[{"base64":"ZnJvbSAuIGltcG9ydCBwYXJzZXIKCmRlZiBjaG9vc2UodmFsdWUpOgogICAgaWYgdmFsdWU6CiAgICAgICAgcmV0dXJuIDEKICAgIHJldHVybiAwCg==","object_id":"619dd2aa0d86bec82bdc88f2bbfc166e233feeb7","path":"src/widget/app.py","size":85}],"packet_id":"sha256:7997375eb124d18feb1dd2ff1f3db6cd8cee7898b6547b0ffe121635c9cb4362","subject":{"kind":"LOCAL_GIT","object_format":"sha1","repository_id":"sha256:82213dcc32cfbeb5300f0011e499ccfddfaa6bb8dd6006afd8a28bd700cf6ece","revision":"505ec5559236affd51ee6621b0eb54780bcd0e11","roots":["505ec5559236affd51ee6621b0eb54780bcd0e11"],"tree":"a11d47f209c720b4036bab407ed91550e55529d0"},"total_bytes":85}